➡️create table Books1
(
book_id INT,
title VARCHAR(100),
author VARCHAR(50),
published_year INT,
price DECIMAL(10,2)
);
Query OK, 0 rows affected (0.03 sec)

➡️desc Books1;
+----------------+---------------+------+-----+---------+-------+
| Field          | Type          | Null | Key | Default | Extra |
+----------------+---------------+------+-----+---------+-------+
| book_id        | int           | YES  |     | NULL    |       |
| title          | varchar(100)  | YES  |     | NULL    |       |
| author         | varchar(50)   | YES  |     | NULL    |       |
| published_year | int           | YES  |     | NULL    |       |
| price          | decimal(10,2) | YES  |     | NULL    |       |
+----------------+---------------+------+-----+---------+-------+
5 rows in set (0.01 sec)

➡️insert into Books1 

Query OK, 8 rows affected (0.01 sec)
Records: 8  Duplicates: 0  Warnings: 0

➡️select * from Books1;
+---------+----------------------+--------------------+----------------+--------+
| book_id | title                | author             | published_year | price  |
+---------+----------------------+--------------------+----------------+--------+
|       1 | 2 States             | Chetan Bhagat      |           2016 | 200.00 |
|       2 | The Guide            | R.K. Narayan       |           1958 | 450.00 |
|       3 | Malgudi Days         | R.K. Narayan       |           1982 | 400.00 |
|       4 | The Room on the Roof | Ruskin Bond        |           1956 | 350.00 |
|       5 | Half Girlfriend      | Chetan Bhagat      |           2017 | 220.00 |
|       6 | Untitled             | Anonymous          |           1995 | 100.00 |
|       7 | Wings of Fire        | A.P.J. Abdul Kalam |           1999 | 600.00 |
|       8 | The Blue Umbrella    | Ruskin Bond        |           1974 | 280.00 |
+---------+----------------------+--------------------+----------------+--------+
8 rows in set (0.00 sec)

➡️update Books1 set price = 250.00 where author = 'chetan bhagat' and published_year >2015;
Query OK, 2 rows affected (0.01 sec)
Rows matched: 2  Changed: 2  Warnings: 0

➡️update Books1 set price = 300.00 where author IN ('R.K. Narayan', 'Ruskin Bond');
Query OK, 4 rows affected (0.01 sec)
Rows matched: 4  Changed: 4  Warnings: 0

➡️delete from Books1 where price > 500;
Query OK, 1 row affected (0.00 sec)

➡️delete from Books1 where author = 'Anonymous' OR published_year < 2000;
Query OK, 5 rows affected (0.01 sec)

➡️ALTER TABLE Books1 ADD COLUMN language VARCHAR(30);
Query OK, 0 rows affected (0.03 sec)
Records: 0  Duplicates: 0  Warnings: 0

➡️UPDATE Books1 SET language = 'Hindi' WHERE title = 'Half Girlfriend';
Query OK, 1 row affected (0.01 sec)
Rows matched: 1  Changed: 1  Warnings: 0

➡️UPDATE Books1 SET language = 'English' WHERE title = 'The guide';

➡️UPDATE Books1 SET language = 'Tamil' WHERE title = 'Wings of Fire';
Query OK, 0 rows affected (0.00 sec)
Rows matched: 0  Changed: 0  Warnings: 0

➡️ALTER TABLE Books1 ADD COLUMN publisher VARCHAR(50);
Query OK, 0 rows affected (0.03 sec)
Records: 0  Duplicates: 0  Warnings: 0

➡️UPDATE Books1 SET publisher = 'Penguin' WHERE title = '2 States';
Query OK, 1 row affected (0.01 sec)
Rows matched: 1  Changed: 1  Warnings: 0

UPDATE Books1 SET publisher = 'HarperCollins' WHERE title = 'Half Girlfriend';
Query OK, 1 row affected (0.01 sec)
Rows matched: 1  Changed: 1  Warnings: 0

➡️alter table Books1 modify column price decimal(12,4);
Query OK, 2 rows affected (0.06 sec)
Records: 2  Duplicates: 0  Warnings: 0

➡️alter table Books1 drop column published_year;
Query OK, 0 rows affected (0.03 sec)
Records: 0  Duplicates: 0  Warnings: 0

➡️RENAME TABLE Books1 TO library_books;
Query OK, 0 rows affected (0.03 sec)

➡️delete from library_books where language = 'Hindi' and price <200;
Query OK, 0 rows affected (0.00 sec)

➡️UPDATE library_books SET price = 350.00 WHERE language = 'English' AND price < 300;
Query OK, 0 rows affected (0.00 sec)
Rows matched: 0  Changed: 0  Warnings: 0

➡️select * from library_books;
+---------+-----------------+---------------+----------+----------+---------------+
| book_id | title           | author        | price    | language | publisher     |
+---------+-----------------+---------------+----------+----------+---------------+
|       1 | 2 States        | Chetan Bhagat | 250.0000 | NULL     | Penguin       |
|       5 | Half Girlfriend | Chetan Bhagat | 250.0000 | Hindi    | HarperCollins |
+---------+-----------------+---------------+----------+----------+---------------+
2 rows in set (0.00 sec)








